[
  {
    "id": "badge.onboarding.first_login",
    "name": "我來了！",
    "description": "第一次打開平台，展開你的英語冒險。",
    "condition": "第一次成功登入平台",
    "category": "onboarding",
    "type": "one_time",
    "reset_on_achieve": false,
    "display_count": false,
    "tier_group": null,
    "tier_level": null,
    "threshold": null,
    "icon_placeholder": null,
    "status": "draft",
    "code": "OB-01"
  },
  {
    "id": "badge.onboarding.unit0_complete",
    "name": "暖身起步",
    "description": "完成新手起手式，學會了教室裡最常用的招呼語跟代名詞。",
    "condition": "完成單元 0（教室常用語，Greetings／Pronouns 兩個主題）全部單字練習",
    "category": "onboarding",
    "type": "one_time",
    "reset_on_achieve": false,
    "display_count": false,
    "tier_group": null,
    "tier_level": null,
    "threshold": null,
    "icon_placeholder": null,
    "status": "draft",
    "code": "OB-02"
  },
  {
    "id": "badge.onboarding.first_stage_d",
    "name": "初次過關",
    "description": "第一次完整打通一個主題的綜合關卡與會話練習，正式踏上學習之路。",
    "condition": "第一次同時通過任一主題的 Stage D 綜合關卡與 Stage E 會話練習",
    "category": "onboarding",
    "type": "one_time",
    "reset_on_achieve": false,
    "display_count": false,
    "tier_group": null,
    "tier_level": null,
    "threshold": null,
    "icon_placeholder": null,
    "status": "draft",
    "code": "OB-03"
  },
  {
    "id": "badge.onboarding.first_favorite",
    "name": "我的收藏",
    "description": "把第一個喜歡的單字收進口袋。",
    "condition": "第一次將單字加入「最喜歡的單字」收藏",
    "category": "onboarding",
    "type": "one_time",
    "reset_on_achieve": false,
    "display_count": false,
    "tier_group": null,
    "tier_level": null,
    "threshold": null,
    "icon_placeholder": null,
    "status": "draft",
    "code": "OB-04"
  },
  {
    "id": "badge.vocab_milestone.50",
    "name": "單字小達人 50",
    "description": "累計學會 50 個單字，字彙量越來越壯大。",
    "condition": "累計習得單字量（習得單字清單）達 50 個",
    "category": "vocab_milestone",
    "type": "one_time",
    "reset_on_achieve": false,
    "display_count": false,
    "tier_group": "vocab_milestone",
    "tier_level": 1,
    "threshold": 50,
    "icon_placeholder": null,
    "status": "draft",
    "code": "VM-01"
  },
  {
    "id": "badge.vocab_milestone.100",
    "name": "單字小達人 100",
    "description": "累計學會 100 個單字，字彙量越來越壯大。",
    "condition": "累計習得單字量（習得單字清單）達 100 個",
    "category": "vocab_milestone",
    "type": "one_time",
    "reset_on_achieve": false,
    "display_count": false,
    "tier_group": "vocab_milestone",
    "tier_level": 2,
    "threshold": 100,
    "icon_placeholder": null,
    "status": "draft",
    "code": "VM-02"
  },
  {
    "id": "badge.vocab_milestone.200",
    "name": "單字小達人 200",
    "description": "累計學會 200 個單字，字彙量越來越壯大。",
    "condition": "累計習得單字量（習得單字清單）達 200 個",
    "category": "vocab_milestone",
    "type": "one_time",
    "reset_on_achieve": false,
    "display_count": false,
    "tier_group": "vocab_milestone",
    "tier_level": 3,
    "threshold": 200,
    "icon_placeholder": null,
    "status": "draft",
    "code": "VM-03"
  },
  {
    "id": "badge.vocab_milestone.500",
    "name": "單字小達人 500",
    "description": "累計學會 500 個單字，字彙量越來越壯大。",
    "condition": "累計習得單字量（習得單字清單）達 500 個",
    "category": "vocab_milestone",
    "type": "one_time",
    "reset_on_achieve": false,
    "display_count": false,
    "tier_group": "vocab_milestone",
    "tier_level": 4,
    "threshold": 500,
    "icon_placeholder": null,
    "status": "draft",
    "code": "VM-04"
  },
  {
    "id": "badge.vocab_milestone.all",
    "name": "字彙大師",
    "description": "習得規劃範圍內的全部單字，字彙量已涵蓋完整範圍。",
    "condition": "累計習得單字量達規劃總字數（約 600 字，實際門檻依內容庫最終字數動態計算）",
    "category": "vocab_milestone",
    "type": "one_time",
    "reset_on_achieve": false,
    "display_count": false,
    "tier_group": "vocab_milestone",
    "tier_level": 5,
    "threshold": null,
    "icon_placeholder": null,
    "status": "draft",
    "code": "VM-05"
  },
  {
    "id": "badge.questions_milestone.50",
    "name": "練習小白",
    "description": "累計完成 50 題練習，扎扎實實累積實力。",
    "condition": "累計完成的題目數量達 50 題（不限題型）",
    "category": "questions_milestone",
    "type": "one_time",
    "reset_on_achieve": false,
    "display_count": false,
    "tier_group": "questions_milestone",
    "tier_level": 1,
    "threshold": 50,
    "icon_placeholder": null,
    "status": "draft",
    "code": "QM-01"
  },
  {
    "id": "badge.questions_milestone.200",
    "name": "練習高手",
    "description": "累計完成 200 題練習，扎扎實實累積實力。",
    "condition": "累計完成的題目數量達 200 題（不限題型）",
    "category": "questions_milestone",
    "type": "one_time",
    "reset_on_achieve": false,
    "display_count": false,
    "tier_group": "questions_milestone",
    "tier_level": 2,
    "threshold": 200,
    "icon_placeholder": null,
    "status": "draft",
    "code": "QM-02"
  },
  {
    "id": "badge.questions_milestone.500",
    "name": "練習專家",
    "description": "累計完成 500 題練習，扎扎實實累積實力。",
    "condition": "累計完成的題目數量達 500 題（不限題型）",
    "category": "questions_milestone",
    "type": "one_time",
    "reset_on_achieve": false,
    "display_count": false,
    "tier_group": "questions_milestone",
    "tier_level": 3,
    "threshold": 500,
    "icon_placeholder": null,
    "status": "draft",
    "code": "QM-03"
  },
  {
    "id": "badge.questions_milestone.1000",
    "name": "練習之王",
    "description": "累計完成 1000 題練習，扎扎實實累積實力。",
    "condition": "累計完成的題目數量達 1000 題（不限題型）",
    "category": "questions_milestone",
    "type": "one_time",
    "reset_on_achieve": false,
    "display_count": false,
    "tier_group": "questions_milestone",
    "tier_level": 4,
    "threshold": 1000,
    "icon_placeholder": null,
    "status": "draft",
    "code": "QM-04"
  },
  {
    "id": "badge.game_mastery.match_新手",
    "name": "配對新手",
    "description": "累計完成 30 題「配對」題型，對這種題型已經很熟練。",
    "condition": "累計完成「配對」題型達 30 題",
    "category": "game_mastery",
    "type": "one_time",
    "reset_on_achieve": false,
    "display_count": false,
    "tier_group": "game_mastery.match",
    "tier_level": 1,
    "threshold": 30,
    "icon_placeholder": null,
    "status": "draft",
    "code": "GM-01"
  },
  {
    "id": "badge.game_mastery.match_大師",
    "name": "配對大師",
    "description": "累計完成 150 題「配對」題型，對這種題型已經很熟練。",
    "condition": "累計完成「配對」題型達 150 題",
    "category": "game_mastery",
    "type": "one_time",
    "reset_on_achieve": false,
    "display_count": false,
    "tier_group": "game_mastery.match",
    "tier_level": 2,
    "threshold": 150,
    "icon_placeholder": null,
    "status": "draft",
    "code": "GM-02"
  },
  {
    "id": "badge.game_mastery.order_新手",
    "name": "排序新手",
    "description": "累計完成 30 題「排序」題型，對這種題型已經很熟練。",
    "condition": "累計完成「排序」題型達 30 題",
    "category": "game_mastery",
    "type": "one_time",
    "reset_on_achieve": false,
    "display_count": false,
    "tier_group": "game_mastery.order",
    "tier_level": 1,
    "threshold": 30,
    "icon_placeholder": null,
    "status": "draft",
    "code": "GM-03"
  },
  {
    "id": "badge.game_mastery.order_大師",
    "name": "排序大師",
    "description": "累計完成 150 題「排序」題型，對這種題型已經很熟練。",
    "condition": "累計完成「排序」題型達 150 題",
    "category": "game_mastery",
    "type": "one_time",
    "reset_on_achieve": false,
    "display_count": false,
    "tier_group": "game_mastery.order",
    "tier_level": 2,
    "threshold": 150,
    "icon_placeholder": null,
    "status": "draft",
    "code": "GM-04"
  },
  {
    "id": "badge.game_mastery.fill_新手",
    "name": "填空新手",
    "description": "累計完成 30 題「填空」題型，對這種題型已經很熟練。",
    "condition": "累計完成「填空」題型達 30 題",
    "category": "game_mastery",
    "type": "one_time",
    "reset_on_achieve": false,
    "display_count": false,
    "tier_group": "game_mastery.fill",
    "tier_level": 1,
    "threshold": 30,
    "icon_placeholder": null,
    "status": "draft",
    "code": "GM-05"
  },
  {
    "id": "badge.game_mastery.fill_大師",
    "name": "填空大師",
    "description": "累計完成 150 題「填空」題型，對這種題型已經很熟練。",
    "condition": "累計完成「填空」題型達 150 題",
    "category": "game_mastery",
    "type": "one_time",
    "reset_on_achieve": false,
    "display_count": false,
    "tier_group": "game_mastery.fill",
    "tier_level": 2,
    "threshold": 150,
    "icon_placeholder": null,
    "status": "draft",
    "code": "GM-06"
  },
  {
    "id": "badge.game_mastery.choice_新手",
    "name": "選擇新手",
    "description": "累計完成 30 題「選擇」題型，對這種題型已經很熟練。",
    "condition": "累計完成「選擇」題型達 30 題",
    "category": "game_mastery",
    "type": "one_time",
    "reset_on_achieve": false,
    "display_count": false,
    "tier_group": "game_mastery.choice",
    "tier_level": 1,
    "threshold": 30,
    "icon_placeholder": null,
    "status": "draft",
    "code": "GM-07"
  },
  {
    "id": "badge.game_mastery.choice_大師",
    "name": "選擇大師",
    "description": "累計完成 150 題「選擇」題型，對這種題型已經很熟練。",
    "condition": "累計完成「選擇」題型達 150 題",
    "category": "game_mastery",
    "type": "one_time",
    "reset_on_achieve": false,
    "display_count": false,
    "tier_group": "game_mastery.choice",
    "tier_level": 2,
    "threshold": 150,
    "icon_placeholder": null,
    "status": "draft",
    "code": "GM-08"
  },
  {
    "id": "badge.unit_completion.unit1",
    "name": "我和身邊的人",
    "description": "完成「我和身邊的人」單元內所有主題的 Stage D 綜合關卡與 Stage E 會話練習。",
    "condition": "「我和身邊的人」單元內所有主題皆通過 Stage D 綜合關卡與 Stage E 會話練習",
    "category": "unit_completion",
    "type": "one_time",
    "reset_on_achieve": false,
    "display_count": false,
    "tier_group": "unit_completion",
    "tier_level": null,
    "threshold": null,
    "icon_placeholder": null,
    "status": "draft",
    "code": "WC-01"
  },
  {
    "id": "badge.unit_completion.unit2",
    "name": "食衣住行",
    "description": "完成「食衣住行」單元內所有主題的 Stage D 綜合關卡與 Stage E 會話練習。",
    "condition": "「食衣住行」單元內所有主題皆通過 Stage D 綜合關卡與 Stage E 會話練習",
    "category": "unit_completion",
    "type": "one_time",
    "reset_on_achieve": false,
    "display_count": false,
    "tier_group": "unit_completion",
    "tier_level": null,
    "threshold": null,
    "icon_placeholder": null,
    "status": "draft",